name,organization,homepage,logo,twitter,crunchbase_url,funding,member,relation,tag,license,headquarters,description,crunchbase_description,crunchbase_homepage,crunchbase_city,crunchbase_region,crunchbase_country,crunchbase_twitter,crunchbase_linkedin,crunchbase_ticker,crunchbase_kind,crunchbase_min_employees,crunchbase_max_employees,category,subcategory,oss,github_repo,github_stars,github_description,github_latest_commit_date,github_latest_commit_link,github_latest_release_date,github_latest_release_link,github_start_commit_date,github_start_commit_link,github_contributors_count,github_contributors_link,accepted,incubation,graduated,dev_stats_url,artwork_url,blog_url,mailing_list_url,slack_url,youtube_url,chat_channel,last_audit_date,last_audit_url
accelerate,,https://huggingface.co/docs/accelerate/index,logos/f975c8a171af33d268543e8ec85de06980f3ddc7069f82db0645d075285c4b1d.svg,,,,,,,,,Accelerate is a library that enables the same PyTorch code to be run across distributed configurations,,,,,,,,,,,,Optimizations,MLOps,,,,,,,,,,,,,,,,,,,,,,,,
AdaptDL,,https://adaptdl.readthedocs.io/en/latest/,logos/532512bdae901d661538ee38bb165d61918199ab2ba8f4d4cf0fddb2ed742647.svg,,,,,,,,,"AdaptDL is a resource-adaptive deep learning (DL) training and scheduling framework, and is part of the CASL open source project.",,,,,,,,,,,,Training,General,,,,,,,,,,,,,,,,,,,,,,,,
AdverTorch,,https://advertorch.readthedocs.io/en/latest/,logos/eec3e6838be8fa53a5d16513a8d774a10163c261bbef2fbb1172f7f33954dfd9.svg,,,,,,,,,A Toolbox for Adversarial Robustness Research,,,,,,,,,,,,Modeling,Adversarial & Robustness,,,,,,,,,,,,,,,,,,,,,,,,
Albumentations,,https://albumentations.ai/docs/,logos/9c283e8d47d4c3f87139e047313bbb92c6f038a28d7d1ceea7378542b33b9dd5.svg,,,,,,,,,a Python library for image augmentation used in deep learning and computer vision tasks to increase the quality of trained models. The purpose of image augmentation is to create new training samples from the existing data.,,,,,,,,,,,,Modeling,Computer Vision,,,,,,,,,,,,,,,,,,,,,,,,
AllenNLP,,https://allenai.org/allennlp,logos/43d3a869c90be770813540f0fd05114f0250a9fb796e52ed7f7ceb33772ad2ef.svg,,,,,,,,,"An NLP research library, built on PyTorch, for developing state-of-the-art deep learning models on a wide variety of linguistic tasks.",,,,,,,,,,,,Modeling,Language,,,,,,,,,,,,,,,,,,,,,,,,
Anomalib,,https://anomalib.readthedocs.io/en/latest/,logos/79211c70ad6c0b096a678d6642e449e908438c6ba9ea651323b55b258a1a99ac.svg,,,,,,,,,"An anomaly detection library comprising state-of-the-art algorithms and features such as experiment management, hyper-parameter optimization, and edge inference.",,,,,,,,,,,,Modeling,Computer Vision,,,,,,,,,,,,,,,,,,,,,,,,
avalanche,,http://avalanche.continualai.org/,logos/6db724b646af4bb6a96bf1e939a4018ee5f01db33e92af69a611275266ba90f5.svg,,,,,,,,,"Avalanche is an End-to-End Continual Learning Library based on PyTorch, for fast prototyping, training, and reproducible evaluation of continual learning algorithms.",,,,,,,,,,,,Training,Continuous Learning,,,,,,,,,,,,,,,,,,,,,,,,
baal,,https://baal.readthedocs.io/,logos/e52fe477062933115c9eee93722f40f2dba311e6935fb12b5bf490fc94c26eb5.svg,,,,,,,,,Baal is a Bayesian active learning library. Provides methods to do posterior distribution sampling in order to maximize the efficiency of labelling during active learning. Our library is suitable for research and industrial applications.,,,,,,,,,,,,Training,Probabilistic & Optimization,,,,,,,,,,,,,,,,,,,,,,,,
BoTorch,,https://botorch.org/,logos/bf6001cce117af4ae13495875da21ba11ba34f5d42b525ce555f61452ad9fc6d.svg,,,,,,,,,A Framework for Efficient Monte-Carlo Bayesian Optimization,,,,,,,,,,,,Training,Probabilistic & Optimization,,,,,,,,,,,,,,,,,,,,,,,,
Captum,,https://captum.ai/docs/introduction.html,logos/2abc1fc7558376c329b2798f7bcde761b3644e8805d84dc631370e0e76d75b8d.svg,,,,,,,,,"An open source, extensible library for model interpretability built on PyTorch.",,,,,,,,,,,,Modeling,Adversarial & Robustness,,,,,,,,,,,,,,,,,,,,,,,,
Catalyst,,https://catalyst-team.com/,logos/b8f9b0d3ee7df42d688ddfaf95b3177f256d68521167ac27b601778e339fbedc.svg,,,,,,,,,"Catalyst is a PyTorch framework for Deep Learning Research and Development. It focuses on reproducibility, rapid experimentation, and codebase reuse so you can create something new rather than write yet another train loop.",,,,,,,,,,,,Training,General,,,,,,,,,,,,,,,,,,,,,,,,
Clear ML,,https://clear.ml/,logos/b8f9b0d3ee7df42d688ddfaf95b3177f256d68521167ac27b601778e339fbedc.svg,,,,,,,,,Suite of tools to streamline your AI workflow.,,,,,,,,,,,,Optimizations,MLOps,,,,,,,,,,,,,,,,,,,,,,,,
Clinica DL,,https://clinicadl.readthedocs.io/en/latest/,logos/0e35348df86096d30232c0f852e0821acb387f280097ad52f6b298ee03147ee8.svg,,,,,,,,,"open-source deep learning software for reproducible neuroimaging processing. It can be seen as the deep learning extension of Clinica, an open-source Python library for neuroimaging preprocessing and analysis.",,,,,,,,,,,,Modeling,Medical & Biology,,,,,,,,,,,,,,,,,,,,,,,,
Colossal-LLaMA-2,,https://www.colossalai.org/,logos/9dad1dc0f5e62ccaae15a7b3d9df96926275a1b075aad0107a87dee756bcf9be.svg,,,,,,,,,This project is no longer available,,,,,,,,,,,,Modeling,Language,,,,,,,,,,,,,,,,,,,,,,,,
ColossalAI,,https://www.colossalai.org/,logos/2125379104f8c98deea6e3dd3e0b2af88238792c2f41420624c1a142642c69ca.svg,,,,,,,,,Tools to kickstart distributed training and inference,,,,,,,,,,,,Training,General,,,,,,,,,,,,,,,,,,,,,,,,
composer,,http://docs.mosaicml.com/,logos/23206110f1d95753c27e1ebe4c63c6bc2c3b86060c4b332516cd9a3931f1900f.svg,,,,,,,,,"A open-source deep learning training library optimized for scalability and usability, integrating best practices for efficient, multi-node training",,,,,,,,,,,,Training,General,,,,,,,,,,,,,,,,,,,,,,,,
CrypTen,,https://crypten.readthedocs.io/en/latest/,logos/a84661f05548b18ae3aa8e49e95af0fbcc12300d9482db746e87a8ab2f596531.svg,,,,,,,,,CrypTen is a Privacy Preserving Machine Learning framework written using PyTorch to train models using encrypted data. It is currently not production ready and its main use is as a research framework,,,,,,,,,,,,Training,Privacy,,,,,,,,,,,,,,,,,,,,,,,,
DeepSpeed,,https://www.deepspeed.ai/,logos/6a721f2f0c7a39901db79faf3d4307b17472c558462574a3ad699666f4d0e3f3.svg,,,,,,,,,"DeepSpeed is a deep learning optimization library that makes distributed training and inference easy, efficient, and effective.",,,,,,,,,,,,Optimizations,Distributed,,,,,,,,,,,,,,,,,,,,,,,,
Depyf,,https://depyf.readthedocs.io/en/latest/,logos/e4a063d36b8096ad076ac1c71881f1be4ccc0a18433cd7541d08de40f2c3370f.svg,,,,,,,,,depyf is a tool to help you understand debug and get insights into pytorch.compile,,,,,,,,,,,,Optimizations,Compilers & Runtimes,,,,,,,,,,,,,,,,,,,,,,,,
Detectron2,,https://detectron2.readthedocs.io/en/latest/,logos/09c4e847ff560f506f21bd599257ed2204e309e54cfd66f008f2d2c40a46244b.svg,,,,,,,,,"is a platform for object detection, segmentation and other visual recognition tasks.",,,,,,,,,,,,Modeling,Computer Vision,,,,,,,,,,,,,,,,,,,,,,,,
Determined,,https://determined.ai/,logos/6f06ce54ac2345f4d76475807a8d81d20d4f6d8f1f017ac591fb22f312ef329c.svg,,,,,,,,,"Determined is an open-source machine learning platform that simplifies distributed training, hyperparameter tuning, experiment tracking, and resource management. Works with PyTorch and TensorFlow.",,,,,,,,,,,,Optimizations,MLOps,,,,,,,,,,,,,,,,,,,,,,,,
DGL,,https://www.dgl.ai/,logos/8bc26a2c13a583b1695caeee24b08ead02adb0d16645e0d2763ea37305fae388.svg,,,,,,,,,"Python package built to ease deep learning on graph, on top of existing DL frameworks.  Fast and memory-efficient message passing primitives for training Graph Neural Networks.",,,,,,,,,,,,Modeling,Specialized,,,,,,,,,,,,,,,,,,,,,,,,
Diffusers,,https://huggingface.co/docs/diffusers/index,logos/ffc8bf3d4d9c6e89044e907ea8b49195426ef764da054041f80845be8605c48e.svg,,,,,,,,,"Pretrained diffusion models for generating images, audio, and even 3D structures of molecules. Whether you are looking for a simple inference solution or want to train your own diffusion model, Diffusers is a modular toolbox that supports both",,,,,,,,,,,,Modeling,Specialized,,,,,,,,,,,,,,,,,,,,,,,,
einops,,https://einops.rocks/,logos/b5a90edf576208a5d90039a11703e94d01d4d4941c3bb98702a13de77d0cbec3.svg,,,,,,,,,"Flexible and powerful tensor operations for readable and reliable code (for pytorch, jax, TF and others)",,,,,,,,,,,,Optimizations,General,,,,,,,,,,,,,,,,,,,,,,,,
Ensemble-Pytorch,,https://ensemble-pytorch.readthedocs.io/,logos/1a5daa080e0d4c6242967eeac5734b744501e8d1bfe8a1f86e4305047a928ef0.svg,,,,,,,,,unified ensemble framework for PyTorch to improve the performance and robustness of your ensemble based deep learning model,,,,,,,,,,,,Modeling,Adversarial & Robustness,,,,,,,,,,,,,,,,,,,,,,,,
FairScale,,https://github.com/facebookresearch/fairscale,logos/76b44191e2f21640c78f4d1afc3679f6bdefb6187441da1a84222ee5be3fb5f7.svg,,,,,,,,,PyTorch extension library for high performance and large scale training. This library extends basic PyTorch capabilities while adding new SOTA scaling techniques.,,,,,,,,,,,,Optimizations,Distributed,,,,,,,,,,,,,,,,,,,,,,,,
fastai,,https://docs.fast.ai/,logos/9b1d9cefe662d9c4a595cbe44fddc8c2d31a2390f6ac3ac0ae025a8c878a53ce.svg,,,,,,,,,"fastai is a deep learning library which provides practitioners with high-level components that can quickly and easily provide state-of-the-art results in standard deep learning domains, and provides researchers with low-level components that can be mixed and matched to build new approaches",,,,,,,,,,,,Training,General,,,,,,,,,,,,,,,,,,,,,,,,
Flair,,https://github.com/flairNLP/flair,logos/79bb5140f6e438d44b09dbd2bde4ba675f11bb1e19b84e74b0ada9b16c0b034a.svg,,,,,,,,,"Flair allows you to apply our state-of-the-art natural language processing (NLP) models to your text, such as named entity recognition (NER), sentiment analysis, part-of-speech tagging (PoS), special support for biomedical texts, sense disambiguation and classification, with support for a rapidly growing number of languages",,,,,,,,,,,,Modeling,Language,,,,,,,,,,,,,,,,,,,,,,,,
Flower,,https://flower.ai/,logos/af4acf3f0922e8bb18cd7439136d299b7c8ddd7c5b8e7574bb31c17c6b4450b1.svg,,,,,,,,,"A unified approach to federated learning, analytics, and evaluation. Federate any workload, any ML framework, and any programming language",,,,,,,,,,,,Training,Federated Learning,,,,,,,,,,,,,,,,,,,,,,,,
forte,,https://github.com/asyml/forte,logos/841fb71182aaea1282f014f735fb0f7db557d72aa48bcb0b9807fde0859f958d.svg,,,,,,,,,Forte is a flexible and powerful ML workflow builder.,,,,,,,,,,,,Optimizations,MLOps,,,,,,,,,,,,,,,,,,,,,,,,
FuseMedML,,https://pytorch.org/ecosystem/,logos/bed2d7b1ea133092432cc28a1d20d3314098a2c30624894f1bad0ed7162fa03d.svg,,,,,,,,,A python framework accelerating ML based discovery in the medical field by encouraging code reuse,,,,,,,,,,,,Modeling,Medical & Biology,,,,,,,,,,,,,,,,,,,,,,,,
GaNDLF,,https://www.nature.com/articles/s44172-023-00066-3,logos/2c684fbc52871399018ed1bbd4eb4558cf380b37f789128ab453063f072a1377.svg,,,,,,,,,"The Generally Nuanced Deep Learning Framework (GaNDLF) for image segmentation and classification, especially in the biomedical field.",,,,,,,,,,,,Modeling,Medical & Biology,,,,,,,,,,,,,,,,,,,,,,,,
Glow,,https://github.com/pytorch/glow,logos/b3b7299a3f02acbea42cc57cc86165e6ca112e2729f9f7c3b5284ec36b263bf8.svg,,,,,,,,,Glow is a machine learning compiler and execution engine for hardware accelerators. It is designed to be used as a backend for high-level machine learning frameworks. The compiler is designed to allow state of the art compiler optimizations and code generation of neural network graphs,,,,,,,,,,,,Optimizations,Compilers & Runtimes,,,,,,,,,,,,,,,,,,,,,,,,
GPyTorch,,https://arxiv.org/abs/1809.11165,logos/edd7c89043cddc740dd6ccd3746aee9f57a590b76e93440eff93fb7272c3f4ce.svg,,,,,,,,,"GPyTorch is a Gaussian process library implemented using PyTorch. GPyTorch is designed for creating scalable, flexible, and modular Gaussian process models with ease",,,,,,,,,,,,Training,Probabilistic & Optimization,,,,,,,,,,,,,,,,,,,,,,,,
higher,,https://higher.readthedocs.io/en/latest/.,logos/1b11a1d950e1c79a1d207dbd7cd3233a207fa9056d41dd6d8f6d826f136038ff.svg,,,,,,,,,higher is a pytorch library allowing users to obtain higher order gradients over losses spanning training loops rather than individual training steps.,,,,,,,,,,,,Optimizations,General,,,,,,,,,,,,,,,,,,,,,,,,
Horovod,,http://horovod.ai/,logos/a6f46dcbeb116393f35638875cc39a90f61ebc28453af34bf89ce3185da131ae.svg,,,,,,,,,"Horovod is a distributed deep learning training framework for TensorFlow, Keras, PyTorch, and Apache MXNet",,,,,,,,,,,,Optimizations,Distributed,,,,,,,,,,,,,,,,,,,,,,,,
Hummingbird,,https://github.com/microsoft/hummingbird,logos/c0d704d4e08b297aadf925661feaf0dece433d3da38e551a9b0b0d326880447f.svg,,,,,,,,,Hummingbird is a library for compiling trained traditional ML models into tensor computations. Hummingbird allows users to seamlessly leverage neural network frameworks (such as PyTorch) to accelerate traditional ML models.,,,,,,,,,,,,Training,General,,,,,,,,,,,,,,,,,,,,,,,,
Hydra,,https://hydra.cc/,logos/cccea004a9de0d9bfd5ab086ec975ab271e67b75172e0526d0294b8e158b6db2.svg,,,,,,,,,simplifies the development of research and other complex applications. The key feature is the ability to dynamically create a hierarchical configuration by composition and override it through config files and the command line. The name Hydra comes from its ability to run multiple similar jobs - much like a Hydra with multiple heads.,,,,,,,,,,,,Optimizations,MLOps,,,,,,,,,,,,,,,,,,,,,,,,
Ignite,,https://pytorch-ignite.ai/,logos/35bb1388cfcd432baba2f56afef9724cf9bbeca68724e9adcb4232272ad8309f.svg,,,,,,,,,High-level library to help with training and evaluating neural networks in PyTorch,,,,,,,,,,,,Training,General,,,,,,,,,,,,,,,,,,,,,,,,
intel-extension-for-pytorch,,https://intel.github.io/intel-extension-for-pytorch/,logos/149058a8b3c96359ac2f000c8958b4899897602728d52d917f9335d1e0273617.svg,,,,,,,,,A Python extension to optimize performance on an Intel platform.,,,,,,,,,,,,Optimizations,Compilers & Runtimes,,,,,,,,,,,,,,,,,,,,,,,,
ivy,,https://ivy.dev/,logos/4ac7177a12ab6aa7b56c2420367cbe3b6e1be0de2f9753d69198f5ca9a7731bb.svg,,,,,,,,,Convert Machine Learning Code Between Frameworks,,,,,,,,,,,,Optimizations,General,,,,,,,,,,,,,,,,,,,,,,,,
joeynmt,,https://joeynmt.readthedocs.io/en/latest/#,logos/817179366550e656ee07a69f74369f9b49b23e815c2d4c3d5a092fbf4318dbc9.svg,,,,,,,,,JoeyNMT is a minimalist neural machine translation toolkit for educational purposes.,,,,,,,,,,,,Modeling,Language,,,,,,,,,,,,,,,,,,,,,,,,
Kornia,,https://kornia.github.io/,logos/68d50512b8d058f5ae4c92b0fdb1a54132e0b208cb573c1b84bb19e7a2cabd4c.svg,,,,,,,,,Kornia is a geometric computer vision Library for spatial AI library that allows classical computer vision to be integrated into deep learning models.,,,,,,,,,,,,Modeling,Computer Vision,,,,,,,,,,,,,,,,,,,,,,,,
L5Kit,,https://woven-planet.github.io/l5kit/,logos/7dabfc94ffc28d1fd628346c3d70bb5a0fa4ae514b5323cad25267cd71aa3fab.svg,,,,,,,,,"A python library with functionality for the development and training of learned prediction, planning and simulation models for autonomous driving applications.",,,,,,,,,,,,Modeling,Specialized,,,,,,,,,,,,,,,,,,,,,,,,
Lightly,,https://docs.lightly.ai/self-supervised-learning/,logos/5135c80fa8aeb01b5a93eb51f1c869d3e920e89759d25f423e0edb513df1fd02.svg,,,,,,,,,LightlySSL is a computer vision framework for self-supervised learning.,,,,,,,,,,,,Modeling,Computer Vision,,,,,,,,,,,,,,,,,,,,,,,,
ludwig,,https://ludwig.ai/latest/,logos/6e299a3f1f6df294a97064d136dd13a8078ec5ccc3d9cfdf4f3f57faf17e4b3b.svg,,,,,,,,,Ludwig is a low-code framework for building custom AI models like LLMs and other deep neural networks.,,,,,,,,,,,,Training,General,,,,,,,,,,,,,,,,,,,,,,,,
MMEditing,,https://mmagic.readthedocs.io/en/latest/,logos/2dd6eb493139d0728db74c27c9fd20e49fc83dd40a459aa1dfee080548d9651b.svg,,,,,,,,,"Image and Video Restoration, Editing and Generation Toolbox",,,,,,,,,,,,Modeling,Computer Vision,,,,,,,,,,,,,,,,,,,,,,,,
MMF,,https://mmf.sh/,logos/0c6791d31524bbcc5d00788ef39db3ff6576fdd3d3b1f8cea530d5c551e9098f.svg,,,,,,,,,A modular framework for vision & language multimodal research.,,,,,,,,,,,,Modeling,Multimodal,,,,,,,,,,,,,,,,,,,,,,,,
MONAI,,https://monai.io/,logos/05c4cdff595fa70e0ca8175384c2fbe4efc7c321437d8fd14bd6f13a9671fb74.svg,,,,,,,,,AI Toolkit for Healthcare Imaging,,,,,,,,,,,,Modeling,Medical & Biology,,,,,,,,,,,,,,,,,,,,,,,,
NeMo,,https://docs.nvidia.com/nemo-framework/user-guide/latest/overview.html,logos/28338dbf8ea96d2f14e1e737ecab8f55ada4616e445a10a89f0cb2c019ee8f14.svg,,,,,,,,,"A scalable generative AI framework built for researchers and developers working on Large Language Models, Multimodal, and Speech AI (Automatic Speech Recognition and Text-to-Speech)",,,,,,,,,,,,Modeling,Multimodal,,,,,,,,,,,,,,,,,,,,,,,,
neural-compressor,,https://intel.github.io/neural-compressor/latest/docs/source/Welcome.html,logos/ba40986b1563b5634522df1bb286e54e543fea3a4ce7e5d0f72c2de633c074f5.svg,,,,,,,,,An open-source Python library supporting popular model compression techniques on all deep learning frameworks.,,,,,,,,,,,,Optimizations,General,,,,,,,,,,,,,,,,,,,,,,,,
OctoML Profiler,,https://github.com/octoml/octoml-profile,logos/6a0430bf99ada8d6b9a2f7c296d8719bd6d5081f40036783c1ee51c58ae73217.svg,,,,,,,,,octoml-profile is a python library and cloud service that enables ML engineers to easily assess the performance and cost of PyTorch models on cloud hardware with state-of-the-art ML acceleration technology.,,,,,,,,,,,,Optimizations,Compilers & Runtimes,,,,,,,,,,,,,,,,,,,,,,,,
ONNX runtime,,https://onnxruntime.ai/,logos/a2ab7ad7ece050a1a7e0e667813b6992c1abc606d2112dd11c8c84836b5ba522.svg,,,,,,,,,High performance ML inferencing and training accelerator,,,,,,,,,,,,Optimizations,Compilers & Runtimes,,,,,,,,,,,,,,,,,,,,,,,,
Opacus,,https://opacus.ai/,logos/93e7f58529785d31148daadf57a83ea2c2f8a5881b6825df426596b79b6954ad.svg,,,,,,,,,Train PyTorch models with Differential Privacy,,,,,,,,,,,,Training,Privacy,,,,,,,,,,,,,,,,,,,,,,,,
OpenCompass,,https://opencompass.org.cn/home,logos/7a70f2cbec75cbed6adfa360674d53e5fd6536ee1b342b52588a3dbd35ef8860.svg,,,,,,,,,"OpenCompass is an LLM evaluation platform, supporting a wide range of models (Llama3, Mistral, InternLM2,GPT-4,LLaMa2, Qwen,GLM, Claude, etc) over 100+ datasets.",,,,,,,,,,,,Modeling,Language,,,,,,,,,,,,,,,,,,,,,,,,
OpenMMLab,,https://openmmlab.com/,logos/4efdc7f99d6658760637db639f854554798b6fac64d661903c68e7728e5014ba.svg,,,,,,,,,Open-source computer vision algorithms and models.,,,,,,,,,,,,Modeling,Computer Vision,,,,,,,,,,,,,,,,,,,,,,,,
Optuna,,https://optuna.org/,logos/221ccf5311fc9739ea42133e7727c4e1e3bbdb761fee27e5f71434e93ea35740.svg,,,,,,,,,"Optuna is an automatic hyperparameter optimization software framework, particularly designed for machine learning.",,,,,,,,,,,,Training,Probabilistic & Optimization,,,,,,,,,,,,,,,,,,,,,,,,
padl,,https://lf1-io.github.io/padl/latest/,logos/c0324d6b677e731d34b894562042072e4a31734082e9134609e1b68c251bc3d9.svg,,,,,,,,,A pipeline builder for PyTorch.,,,,,,,,,,,,Optimizations,MLOps,,,,,,,,,,,,,,,,,,,,,,,,
ParIAI,,https://parl.ai/,logos/0fd85ffd8df76e3a4ece780593d9f95b8c193bf33cf97c16955e93ca59b757fd.svg,,,,,,,,,A framework for training and evaluating AI models on a variety of openly available dialogue datasets.,,,,,,,,,,,,Modeling,Language,,,,,,,,,,,,,,,,,,,,,,,,
PennyLane,,https://pennylane.ai/,logos/2d8e7a169283e296f1d72aad881717481147608ecb440ecb9b92b3c078ce197f.svg,,,,,,,,,"PennyLane is a cross-platform Python library for quantum computing, quantum machine learning, and quantum chemistry. Train a quantum computer the same way as a neural network.",,,,,,,,,,,,Modeling,Quantum,,,,,,,,,,,,,,,,,,,,,,,,
PFRL,,https://github.com/pfnet/pfrl,logos/e207d794eaca709d5667f9e92cefba0497d2124c413b11e863c1246dc2307b89.svg,,,,,,,,,PFRL is a PyTorch-based deep reinforcement learning library,,,,,,,,,,,,Training,Reinforcement Learning,,,,,,,,,,,,,,,,,,,,,,,,
Polyaxon,,https://polyaxon.com/,logos/c8eb66406bda3aeb5e725039da192ab06ab57b2fa394f0a8ea06e57997fc48c4.svg,,,,,,,,,MLOps Tools For Managing & Orchestrating The Machine Learning LifeCycle,,,,,,,,,,,,Optimizations,MLOps,,,,,,,,,,,,,,,,,,,,,,,,
Pomegranate,,https://pomegranate.readthedocs.io/en/latest/,logos/ebf8effc430934c78a17464087fe36856c0dfe2c390f3e278beac637efb264e0.svg,,,,,,,,,pomegranate is a Python package that implements fast and flexible probabilistic models ranging from individual probability distributions to compositional models such as Bayesian networks and hidden Markov models,,,,,,,,,,,,Training,Probabilistic & Optimization,,,,,,,,,,,,,,,,,,,,,,,,
PopTorch,,https://docs.graphcore.ai/projects/poptorch-user-guide/en/latest/,logos/941ac64f6b2ec287a2dfc558c637747c9af0d2acdcf5e6148bdbfc5e2f8a81d5.svg,,,,,,,,,"PopTorch is a set of extensions for PyTorch enabling models to be trained, evaluated and used on the Graphcore IPU.",,,,,,,,,,,,Optimizations,Compilers & Runtimes,,,,,,,,,,,,,,,,,,,,,,,,
Poutyne,,https://poutyne.org/,logos/a291fe1f4346bc027619c3baebe8eccb7043cece79f64e2582a80056699faa44.svg,,,,,,,,,Poutyne is a simplified framework for PyTorch and handles much of the boilerplating code needed to train neural networks.,,,,,,,,,,,,Training,General,,,,,,,,,,,,,,,,,,,,,,,,
PyKale,,https://pykale.github.io/,logos/1514ccbb316a3ae5a772df0cb382bd6917c12793cc8174f0699d4fb19d1acec0.svg,,,,,,,,,"PyKale has a unified pipeline-based API and focuses on multimodal learning and transfer learning for graphs, images, and videos at the moment, with supporting models on deep learning and dimensionality reduction.",,,,,,,,,,,,Training,Multimodal,,,,,,,,,,,,,,,,,,,,,,,,
PyPose,,https://pypose.org/,logos/8513a8257efd437369eb631ace0e7514cfdce3e6297154043bc263c67f49d128.svg,,,,,,,,,PyPose is a library for Robot Learning with Physics-based Optimization,,,,,,,,,,,,Modeling,Specialized,,,,,,,,,,,,,,,,,,,,,,,,
PyPOTS,,https://pypots.com/,logos/9b443ae59bd33bdee86bbe1d3190c727ce938845d8696ac8e76bd7c662c822a2.svg,,,,,,,,,a Python toolbox for machine learning on Partially-Observed Time Series,,,,,,,,,,,,Modeling,Specialized,,,,,,,,,,,,,,,,,,,,,,,,
Pyro,,https://pyro.ai/,logos/ed7e2a4d5d7f216c73dc8d10febb6720c12b706bd262296605f82b5f01801d60.svg,,,,,,,,,Deep universal probabilistic programming with Python and PyTorch,,,,,,,,,,,,Training,Probabilistic & Optimization,,,,,,,,,,,,,,,,,,,,,,,,
pystiche,,https://github.com/pystiche/pystiche,logos/b024259eacdf1948a9a6dcc2b94a9d67df1e249789ac8d44c6d822e4e7d0cdae.svg,,,,,,,,,Framework for Neural Style Transfer (NST) built upon PyTorch,,,,,,,,,,,,Modeling,Computer Vision,,,,,,,,,,,,,,,,,,,,,,,,
PySyft,,https://www.openmined.org/,logos/ddcdd70695dcc0780072851c60375522b8a616c35ffdec80717cf32b87d21310.svg,,,,,,,,,Perform data science on data that remains in someone else's server,,,,,,,,,,,,Training,Privacy,,,,,,,,,,,,,,,,,,,,,,,,
PyTorch Geometric,,https://pyg.org/,logos/5bf81a10e91e5b5336f31c52500e47e02dc3c860f3d66c7b4936161107dc12c9.svg,,,,,,,,,Graph Neural Network Library for PyTorch,,,,,,,,,,,,Training,Graph,,,,,,,,,,,,,,,,,,,,,,,,
PyTorch Geometric Temporal,,https://github.com/benedekrozemberczki/pytorch_geometric_temporal,logos/e178f77ad4a1b8ba7fa3e617cc445a8b47c1dd88a61972330752cc7ee6dbdd21.svg,,,,,,,,,PyTorch Geometric Temporal is a Spatiotemporal Signal Processing with Neural Machine Learning Models,,,,,,,,,,,,Training,Graph,,,,,,,,,,,,,,,,,,,,,,,,
PyTorch Lightning,,https://lightning.ai/,logos/3e3486bfb4e2fa782678a99e6da800be65f30c9c9f887ef4131bfe7634797187.svg,,,,,,,,,"Pretrain, finetune and deploy AI models on multiple GPUs, TPUs with zero code changes.",,,,,,,,,,,,Training,General,,,,,,,,,,,,,,,,,,,,,,,,
PyTorch Metric Learning,,https://kevinmusgrave.github.io/pytorch-metric-learning/,logos/64fe0aa1a6facd5730cee30d3904885e90f56c6cc79d9f9edda241ecf4585ff7.svg,,,,,,,,,"Modular, flexible, and extensible library for deep metric learning.",,,,,,,,,,,,Training,Self supervised,,,,,,,,,,,,,,,,,,,,,,,,
PyTorch-NLP,,https://pytorchnlp.readthedocs.io/en/latest/,logos/49a408722c78586e14156d60f6d32160a69da86afea96b933f3084dc4157c133.svg,,,,,,,,,Basic Utilities for PyTorch Natural Language Processing (NLP),,,,,,,,,,,,Modeling,Language,,,,,,,,,,,,,,,,,,,,,,,,
PyTorch-Points3d,,https://torch-points3d.readthedocs.io/en/latest/,logos/7c3c77c9fbd88d4dae1e9d32ef70b0b115ad578cacb4f90dda36f4aaefc4cc0d.svg,,,,,,,,,A framework for developing and testing common deep learning models to solve tasks related to unstructured 3D spatial data,,,,,,,,,,,,Modeling,3D,,,,,,,,,,,,,,,,,,,,,,,,
PyTorch3D,,https://pytorch3d.org/,logos/88318438fc9c2bbc4989daf11182ed9ec9e685c4f9f97317d978d87f732f9e96.svg,,,,,,,,,PyTorch3D is a library of reusable components for deep learning with 3D data,,,,,,,,,,,,Modeling,3D,,,,,,,,,,,,,,,,,,,,,,,,
pytorchfi,,https://pytorchfi.dev/,logos/4940f3cf2023e817b489c95cca20b0effbac6407db28e7f6eabe7cd4177aa5e5.svg,,,,,,,,,A runtime fault injection tool for PyTorch,,,,,,,,,,,,Modeling,Adversarial & Robustness,,,,,,,,,,,,,,,,,,,,,,,,
PyTorchVideo,,https://pytorchvideo.org/,logos/ad52117a8e14a31993e1549cd32f76e6d4ddb403826679eee528774a7404729a.svg,,,,,,,,,A deep learning library for video understanding research.,,,,,,,,,,,,Modeling,Specialized,,,,,,,,,,,,,,,,,,,,,,,,
PyTorchXLA,,https://pytorch.org/xla/release/2.1/index.html,logos/56585018fdef58028329687f94025e78d6de2f303e1375427e95af5e2e878703.svg,,,,,,,,,"PyTorch runs on XLA devices, like TPUs, with the torch_xla package.",,,,,,,,,,,,Optimizations,Compilers & Runtimes,,,,,,,,,,,,,,,,,,,,,,,,
